{
  "service_version": "controls-integrity-fixture-pack-v1",
  "data_version": "synthetic-controls-integrity-v1",
  "calendar": [
    "2026-01-02",
    "2026-01-05",
    "2026-01-06",
    "2026-01-08",
    "2026-01-09",
    "2026-01-12"
  ],
  "calendar_basis": "Pinned to fixtures/risk_analytics/risk_summary_fixture_pack.json calendar; FRESHNESS and PUBLICATION_READINESS rows assume prior business-day normalization used that same pinned calendar (ADR-004).",
  "snapshots": [
    {
      "snapshot_id": "SNAP-2026-01-02",
      "as_of_date": "2026-01-02",
      "rows": [
        {
          "node_ref": {
            "hierarchy_scope": "TOP_OF_HOUSE",
            "legal_entity_id": null,
            "node_level": "FIRM",
            "node_id": "FIRM_GRP",
            "node_name": "Firm Group"
          },
          "measure_type": "VAR_1D_99",
          "as_of_date": "2026-01-02",
          "snapshot_id": "SNAP-2026-01-02",
          "check_type": "FRESHNESS",
          "check_state": "PASS",
          "reason_codes": [],
          "evidence_refs": [],
          "is_row_degraded": false
        },
        {
          "node_ref": {
            "hierarchy_scope": "TOP_OF_HOUSE",
            "legal_entity_id": null,
            "node_level": "FIRM",
            "node_id": "FIRM_GRP",
            "node_name": "Firm Group"
          },
          "measure_type": "VAR_1D_99",
          "as_of_date": "2026-01-02",
          "snapshot_id": "SNAP-2026-01-02",
          "check_type": "COMPLETENESS",
          "check_state": "PASS",
          "reason_codes": [],
          "evidence_refs": [],
          "is_row_degraded": false
        },
        {
          "node_ref": {
            "hierarchy_scope": "TOP_OF_HOUSE",
            "legal_entity_id": null,
            "node_level": "FIRM",
            "node_id": "FIRM_GRP",
            "node_name": "Firm Group"
          },
          "measure_type": "VAR_1D_99",
          "as_of_date": "2026-01-02",
          "snapshot_id": "SNAP-2026-01-02",
          "check_type": "LINEAGE",
          "check_state": "PASS",
          "reason_codes": [],
          "evidence_refs": [],
          "is_row_degraded": false
        },
        {
          "node_ref": {
            "hierarchy_scope": "TOP_OF_HOUSE",
            "legal_entity_id": null,
            "node_level": "FIRM",
            "node_id": "FIRM_GRP",
            "node_name": "Firm Group"
          },
          "measure_type": "VAR_1D_99",
          "as_of_date": "2026-01-02",
          "snapshot_id": "SNAP-2026-01-02",
          "check_type": "RECONCILIATION",
          "check_state": "PASS",
          "reason_codes": [],
          "evidence_refs": [],
          "is_row_degraded": false
        },
        {
          "node_ref": {
            "hierarchy_scope": "TOP_OF_HOUSE",
            "legal_entity_id": null,
            "node_level": "FIRM",
            "node_id": "FIRM_GRP",
            "node_name": "Firm Group"
          },
          "measure_type": "VAR_1D_99",
          "as_of_date": "2026-01-02",
          "snapshot_id": "SNAP-2026-01-02",
          "check_type": "PUBLICATION_READINESS",
          "check_state": "PASS",
          "reason_codes": [],
          "evidence_refs": [],
          "is_row_degraded": false
        },
        {
          "node_ref": {
            "hierarchy_scope": "TOP_OF_HOUSE",
            "legal_entity_id": null,
            "node_level": "DIVISION",
            "node_id": "DIV_GM",
            "node_name": "Global Markets"
          },
          "measure_type": "VAR_1D_99",
          "as_of_date": "2026-01-02",
          "snapshot_id": "SNAP-2026-01-02",
          "check_type": "FRESHNESS",
          "check_state": "PASS",
          "reason_codes": [],
          "evidence_refs": [],
          "is_row_degraded": false
        },
        {
          "node_ref": {
            "hierarchy_scope": "TOP_OF_HOUSE",
            "legal_entity_id": null,
            "node_level": "DIVISION",
            "node_id": "DIV_GM",
            "node_name": "Global Markets"
          },
          "measure_type": "VAR_1D_99",
          "as_of_date": "2026-01-02",
          "snapshot_id": "SNAP-2026-01-02",
          "check_type": "COMPLETENESS",
          "check_state": "PASS",
          "reason_codes": [],
          "evidence_refs": [],
          "is_row_degraded": false
        },
        {
          "node_ref": {
            "hierarchy_scope": "TOP_OF_HOUSE",
            "legal_entity_id": null,
            "node_level": "DIVISION",
            "node_id": "DIV_GM",
            "node_name": "Global Markets"
          },
          "measure_type": "VAR_1D_99",
          "as_of_date": "2026-01-02",
          "snapshot_id": "SNAP-2026-01-02",
          "check_type": "LINEAGE",
          "check_state": "PASS",
          "reason_codes": [],
          "evidence_refs": [],
          "is_row_degraded": false
        },
        {
          "node_ref": {
            "hierarchy_scope": "TOP_OF_HOUSE",
            "legal_entity_id": null,
            "node_level": "DIVISION",
            "node_id": "DIV_GM",
            "node_name": "Global Markets"
          },
          "measure_type": "VAR_1D_99",
          "as_of_date": "2026-01-02",
          "snapshot_id": "SNAP-2026-01-02",
          "check_type": "RECONCILIATION",
          "check_state": "PASS",
          "reason_codes": [],
          "evidence_refs": [],
          "is_row_degraded": false
        },
        {
          "node_ref": {
            "hierarchy_scope": "TOP_OF_HOUSE",
            "legal_entity_id": null,
            "node_level": "DIVISION",
            "node_id": "DIV_GM",
            "node_name": "Global Markets"
          },
          "measure_type": "VAR_1D_99",
          "as_of_date": "2026-01-02",
          "snapshot_id": "SNAP-2026-01-02",
          "check_type": "PUBLICATION_READINESS",
          "check_state": "PASS",
          "reason_codes": [],
          "evidence_refs": [],
          "is_row_degraded": false
        },
        {
          "node_ref": {
            "hierarchy_scope": "TOP_OF_HOUSE",
            "legal_entity_id": null,
            "node_level": "DESK",
            "node_id": "DESK_RATES_MACRO",
            "node_name": "Rates Macro"
          },
          "measure_type": "VAR_1D_99",
          "as_of_date": "2026-01-02",
          "snapshot_id": "SNAP-2026-01-02",
          "check_type": "FRESHNESS",
          "check_state": "PASS",
          "reason_codes": [],
          "evidence_refs": [],
          "is_row_degraded": false
        },
        {
          "node_ref": {
            "hierarchy_scope": "TOP_OF_HOUSE",
            "legal_entity_id": null,
            "node_level": "DESK",
            "node_id": "DESK_RATES_MACRO",
            "node_name": "Rates Macro"
          },
          "measure_type": "VAR_1D_99",
          "as_of_date": "2026-01-02",
          "snapshot_id": "SNAP-2026-01-02",
          "check_type": "COMPLETENESS",
          "check_state": "PASS",
          "reason_codes": [],
          "evidence_refs": [],
          "is_row_degraded": false
        },
        {
          "node_ref": {
            "hierarchy_scope": "TOP_OF_HOUSE",
            "legal_entity_id": null,
            "node_level": "DESK",
            "node_id": "DESK_RATES_MACRO",
            "node_name": "Rates Macro"
          },
          "measure_type": "VAR_1D_99",
          "as_of_date": "2026-01-02",
          "snapshot_id": "SNAP-2026-01-02",
          "check_type": "LINEAGE",
          "check_state": "PASS",
          "reason_codes": [],
          "evidence_refs": [],
          "is_row_degraded": false
        },
        {
          "node_ref": {
            "hierarchy_scope": "TOP_OF_HOUSE",
            "legal_entity_id": null,
            "node_level": "DESK",
            "node_id": "DESK_RATES_MACRO",
            "node_name": "Rates Macro"
          },
          "measure_type": "VAR_1D_99",
          "as_of_date": "2026-01-02",
          "snapshot_id": "SNAP-2026-01-02",
          "check_type": "RECONCILIATION",
          "check_state": "PASS",
          "reason_codes": [],
          "evidence_refs": [],
          "is_row_degraded": false
        },
        {
          "node_ref": {
            "hierarchy_scope": "TOP_OF_HOUSE",
            "legal_entity_id": null,
            "node_level": "DESK",
            "node_id": "DESK_RATES_MACRO",
            "node_name": "Rates Macro"
          },
          "measure_type": "VAR_1D_99",
          "as_of_date": "2026-01-02",
          "snapshot_id": "SNAP-2026-01-02",
          "check_type": "PUBLICATION_READINESS",
          "check_state": "PASS",
          "reason_codes": [],
          "evidence_refs": [],
          "is_row_degraded": false
        },
        {
          "node_ref": {
            "hierarchy_scope": "LEGAL_ENTITY",
            "legal_entity_id": "LE-UK-BANK",
            "node_level": "DESK",
            "node_id": "DESK_RATES_MACRO",
            "node_name": "Rates Macro"
          },
          "measure_type": "VAR_1D_99",
          "as_of_date": "2026-01-02",
          "snapshot_id": "SNAP-2026-01-02",
          "check_type": "FRESHNESS",
          "check_state": "PASS",
          "reason_codes": [],
          "evidence_refs": [],
          "is_row_degraded": false
        },
        {
          "node_ref": {
            "hierarchy_scope": "LEGAL_ENTITY",
            "legal_entity_id": "LE-UK-BANK",
            "node_level": "DESK",
            "node_id": "DESK_RATES_MACRO",
            "node_name": "Rates Macro"
          },
          "measure_type": "VAR_1D_99",
          "as_of_date": "2026-01-02",
          "snapshot_id": "SNAP-2026-01-02",
          "check_type": "COMPLETENESS",
          "check_state": "PASS",
          "reason_codes": [],
          "evidence_refs": [],
          "is_row_degraded": false
        },
        {
          "node_ref": {
            "hierarchy_scope": "LEGAL_ENTITY",
            "legal_entity_id": "LE-UK-BANK",